book_id,book_title,book_genre,book_plot,book_author,book_link,book_rating
b26,Jonathan Strange & Mr Norrell,Alternate History,"Sophisticated, witty, and ingeniously convincing, Susanna Clarke's magisterial novel weaves magic into a flawlessly detailed vision of historical England. She has created a world so thoroughly enchanting that eight hundred pages leave readers longing for more.English magicians were once the wonder of the known world, with fairy servants at their beck and call; they could command winds, mountains, and woods. But by the early 1800s they have long since lost the ability to perform magic. They can only write long, dull papers about it, while fairy servants are nothing but a fading memory.But at Hurtfew Abbey in Yorkshire, the rich, reclusive Mr Norrell has assembled a wonderful library of lost and forgotten books from England's magical past and regained some of the powers of England's magicians. He goes to London and raises a beautiful young woman from the dead. Soon he is lending his help to the government in the war against Napoleon Bonaparte, creating ghostly fleets of rain-ships to confuse and alarm the French.",Susanna Clarke,https://images.gr-assets.com/books/1357027589l/14201.jpg,3.8
b27,The Years of Rice and Salt,Alternate History,"It is the fourteenth century and one of the most apocalyptic events in human history is set to occur - the coming of the Black Death. History teaches us that a third of Europe's population was destroyed. But what if? What if the plague killed 99 percent of the population instead? How would the world have changed? This is a look at the history that could have been: a history that stretches across centuries, a history that sees dynasties and nations rise and crumble, a history that spans horrible famine and magnificent innovation. These are the years of rice and salt.",Kim Stanley Robinson,https://images.gr-assets.com/books/1419079388l/2723.jpg,3.7
b28,The Yiddish Policemen's Union,Alternate History,"For sixty years, Jews have prospered in the Federal District of Sitka, a ""temporary"" safe haven created in the wake of revelations of the Holocaust and the shocking 1948 collapse of the fledgling state of Israel. Now the District is set to revert to Alaskan control, and their dream is coming to an end: once again the tides of history threaten to sweep them up and carry them off into the unknown.For sixty years, Jewish refugees and their descendants have prospered in the Federal District of Sitka, a ""temporary"" safe haven created in the wake of revelations of the Holocaust and the shocking 1948 collapse of the fledgling state of Israel. Proud, grateful, and longing to be American, the Jews of the Sitka District have created their own little world in the Alaskan panhandle, a vibrant, gritty, soulful, and complex frontier city that moves to the music of Yiddish. For sixty years they have been left alone, neglected and half-forgotten in a backwater of history. Now the District is set to revert to Alaskan control, and their dream is coming to an end: once again the tides of history threaten to sweep them up and carry them off into the unknown.",Michael Chabon,https://images.gr-assets.com/books/1178032098l/16703.jpg,3.7
b29,And the Roses Bled,Horror ,"A catastrophe occurs in what was meant to be a fun-filled day for Nina and Alisha. Minutes ago, they were on the swings in the Rose Garden and now, Alisha is standing alone, while the help runs frantically. Her sister, Nina, has disappeared, never to be found again. But the bond between them withstands even death. Nina’s ghost circles the house. Is she here just to comfort her now lonely and distraught sister or is she pointing the way to unravel the mystery of her disappearance? the questions remain unanswered until six years later. Another ghost is reaching out to Alisha from the beyond, a ghost only she can see and she has no idea why. Battling the horror, the blood and the nightmares that follow her in this macabre turn of events, will Alisha be able to emerge from the whirlpool that the other side is trying to drown her in",Mehak Daleh ,"https://images-na.ssl-images-amazon.com/images/I/512ynJwtj7L._SX321_BO1,204,203,200_.jpg",4.3
b30,The Shining,Horror ,"Danny is only five years old, but in the words of old Mr Hallorann he is a 'shiner', aglow with psychic voltage. When his father becomes caretaker of the Overlook Hotel, Danny's visions grow out of control.As winter closes in and blizzards cut them off, the hotel seems to develop a life of its own. It is meant to be empty. So who is the lady in Room 217 and who are the masked guests going up and down in the elevator? And why do the hedges shaped like animals seem so alive?Somewhere, somehow, there is an evil force in the hotel - and that, too, is beginning to shine . . .",Stephen King ,https://images.gr-assets.com/books/1353277730l/11588.jpg,4.2
b31,The Green Room,Horror ,"She wears an old uniform,” Nisha continued, “pale white face, dark shadows around her eyes. She is often seen sitting on this very chair. And it is said that the chair is always found in front of the mirror no matter where you leave it.” Rohan Agarwal has been appointed the manager of a play, and how excited he is to work with Chandni Joshi – his childhood crush, and unfortunately, his senior! A happy-go-lucky high school boarder, he has his fun with his friends, enjoys the odd sport and does not think twice before raiding his warden’s office to leak question papers. Then, one misty night, he sneaks into the infamous Green Room; and there, he finds something that wasn’t meant to be found…Mysterious happenings in the Green Room begin to follow. That's when Rohan stumbles on the fact that the same play was supposed to have taken place before, but it was cancelled. There was something evil associated with the play. Something terrible had happened in the Green Room the first time around, or at least, that’s what the stories said. And yet, Rohan finds, the old stories turn out to be true.",Nag Mani,https://images-eu.ssl-images-amazon.com/images/I/519ciGkiDML.jpg,3.9
b32,It,Horror ,"Welcome to Derry, Maine ...It’s a small city, a place as hauntingly familiar as your own hometown. Only in Derry the haunting is real ...They were seven teenagers when they first stumbled upon the horror. Now they are grown-up men and women who have gone out into the big world to gain success and happiness. But none of them can withstand the force that has drawn them back to Derry to face the nightmare without an end, and the evil without a name. ",Stephen King ,https://upload.wikimedia.org/wikipedia/en/5/5a/It_cover.jpg,4.5
b33,Dracula,Horror ,"A rich selection of background and source materials is provided in three areas: Contexts includes probable inspirations for Dracula in the earlier works of James Malcolm Rymer and Emily Gerard. Also included are a discussion of Stoker's working notes for the novel and ""Dracula's Guest,"" the original opening chapter to Dracula. Reviews and Reactions reprints five early reviews of the novel. ""Dramatic and Film Variations"" focuses on theater and film adaptations of Dracula, two indications of the novel's unwavering appeal. David J. Skal, Gregory A. Waller, and Nina Auerbach offer their varied perspectives. Checklists of both dramatic and film adaptations are included.Criticism collects seven theoretical interpretations of Dracula by Phyllis A. Roth, Carol A. Senf, Franco Moretti, Christopher Craft, Bram Dijkstra, Stephen D. Arata, and Talia Schaffer.A Chronology and a Selected Bibliography are included.",Bram Stoker,https://images.gr-assets.com/books/1387151694l/17245.jpg,4
b34,Carrie,Horror ,"arrie knew she should not use the terrifying power she possessed... But one night at her senior prom, Carrie was scorned and humiliated just one time too many, and in a fit of uncontrollable fury she turned her clandestine game into a weapon of horror and destruction...",Stephen King ,https://images.gr-assets.com/books/1166254258l/10592.jpg,4
b35,Frankenstein,Horror ,"Mary Shelley began writing Frankenstein when she was only eighteen. At once a Gothic thriller, a passionate romance, and a cautionary tale about the dangers of science, Frankenstein tells the story of committed science student Victor Frankenstein. Obsessed with discovering the cause of generation and life and bestowing animation upon lifeless matter, Frankenstein assembles a human being from stolen body parts but; upon bringing it to life, he recoils in horror at the creature's hideousness. Tormented by isolation and loneliness, the once-innocent creature turns to evil and unleashes a campaign of murderous revenge against his creator, Frankenstein. Frankenstein, an instant bestseller and an important ancestor of both the horror and science fiction genres, not only tells a terrifying story, but also raises profound, disturbing questions about the very nature of life and the place of humankind within the cosmos: What does it mean to be human? What responsibilities do we have to each other? How far can we go in tampering with Nature? In our age, filled with news of organ donation genetic engineering, and bio-terrorism, these questions are more relevant than ever."," Mary Wollstonecraft Shelley,  Charlotte Gordon",https://images.gr-assets.com/books/1498841231l/35031085.jpg,3.8
b36,Pet Sematary,Horror ,"The road in front of Dr. Louis Creed's rural Maine home frequently claims the lives of neighborhood pets. Louis has recently moved from Chicago to Ludlow with his wife Rachel, their children and pet cat. Near their house, local children have created a cemetery for the dogs and cats killed by the steady stream of transports on the busy highway. Deeper in the woods lies another graveyard, an ancient Indian burial ground whose sinister properties Louis discovers when the family cat is killed.",Stephen King ,https://images.gr-assets.com/books/1480069533l/33124137.jpg,4
b37,The Exorcist,Horror ,"riginally published in 1971, The Exorcist is now a major television series on FOX. It remains one of the most controversial novels ever written and went on to become a literary phenomenon: It spent fifty-seven weeks on the New York Times bestseller list, seventeen consecutively at number one. Inspired by a true story of a child’s demonic possession in the 1940s, William Peter Blatty created an iconic novel that focuses on Regan, the eleven-year-old daughter of a movie actress residing in Washington, D.C. A small group of overwhelmed yet determined individuals must rescue Regan from her unspeakable fate, and the drama that ensues is gripping and unfailingly terrifying.",William Peter Blatty,https://images.gr-assets.com/books/1375168676l/179780.jpg,4.2
b38,Misery,Horror ,"Paul Sheldon. He's a bestselling novelist who has finally met his biggest fan. Her name is Annie Wilkes and she is more than a rabid reader - she is Paul's nurse, tending his shattered body after an automobile accident. But she is also his captor, keeping him prisoner in her isolated house.", Stephen King,https://www.goodreads.com/book/show/10614.Misery,4.14
b39,The Haunting of Hill House,Horror ,"It is the story of four seekers who arrive at a notoriously unfriendly pile called Hill House: Dr. Montague, an occult scholar looking for solid evidence of a ""haunting""; Theodora, the lighthearted assistant; Eleanor, a friendless, fragile young woman well acquainted with poltergeists; and Luke, the future heir of Hill House. At first, their stay seems destined to be merely a spooky encounter with inexplicable phenomena. But Hill House is gathering its powers—and soon it will choose one of them to make its own. ","Shirley Jackson,  Laura Miller ",https://images.gr-assets.com/books/1327871336l/89717.jpg,3.86
b40,The Silence of the Lambs,Horror ,"There's a killer on the loose who knows that beauty is only skin deep, and a trainee investigator who's trying to save her own hide. The only man that can help is locked in an asylum. But he's willing to put a brave face on — if it will help him escape.",Thomas Harris,https://images.gr-assets.com/books/1390426249l/23807.jpg,4.17
b41,Interview with the Vampire,Horror ,"This is the story of Louis, as told in his own words, of his journey through mortal and immortal life. Louis recounts how he became a vampire at the hands of the radiant and sinister Lestat and how he became indoctrinated, unwillingly, into the vampire way of life. His story ebbs and flows through the streets of New Orleans, defining crucial moments such as his discovery of the exquisite lost young child Claudia, wanting not to hurt but to comfort her with the last breaths of humanity he has inside. Yet, he makes Claudia a vampire, trapping her womanly passion, will, and intelligence inside the body of a small child. Louis and Claudia form a seemingly unbreakable alliance and even ""settle down"" for a while in the opulent French Quarter. Louis remembers Claudia's struggle to understand herself and the hatred they both have for Lestat that sends them halfway across the world to seek others of their kind. Louis and Claudia are desperate to find somewhere they belong, to find others who understand, and someone who knows what and why they are.`", Anne Rice,https://images.gr-assets.com/books/1380631642l/43763.jpg,3.99
b42,Rosemary's Baby,Horror ,"Rosemary and Guy Woodhouse, an ordinary young couple, settle into a New York City apartment, unaware that the elderly neighbors and their bizarre group of friends have taken a disturbing interest in them. But by the time Rosemary discovers the horrifying truth, it may be far too late!",Ira Levin,https://images.gr-assets.com/books/1327878603l/228296.jpg,3.99
b43,Ghost Story,Horror ,"For four aging men in the terror-stricken town of Milburn, New York, an act inadvertently carried out in their youth has come back to haunt them. Now they are about to learn what happens to those who believe they can bury the past -- and get away with murder.",Peter Straub,https://images.gr-assets.com/books/1441771752l/19581.jpg,3.95
b44,Heart-Shaped Box,Horror ,"Aging, self-absorbed rock star Judas Coyne has a thing for the macabre -- his collection includes sketches from infamous serial killer John Wayne Gacy, a trepanned skull from the 16th century, a used hangman's noose, Aleister Crowley's childhood chessboard, etc. -- so when his assistant tells him about a ghost for sale on an online auction site, he immediately puts in a bid and purchases it. The black, heart-shaped box that Coyne receives in the mail not only contains the suit of a dead man but also his vengeance-obsessed spirit. The ghost, it turns out, is the stepfather of a young groupie who committed suicide after the 54-year-old Coyne callously used her up and threw her away. Now, determined to kill Coyne and anyone who aids him, the merciless ghost of Craddock McDermott begins his assault on the rocker's sanity",Joe Hill ,https://images.gr-assets.com/books/1328043955l/153025.jpg,3.83
b45,World War Z,Horror ,"The Zombie War came unthinkably close to eradicating humanity. Max Brooks, driven by the urgency of preserving the acid-etched first-hand experiences of the survivors from those apocalyptic years, traveled across the United States of America and throughout the world, from decimated cities that once teemed with upwards of thirty million souls to the most remote and inhospitable areas of the planet. He recorded the testimony of men, women, and sometimes children who came face-to-face with the living, or at least the undead, hell of that dreadful time. World War Z is the result. Never before have we had access to a document that so powerfully conveys the depth of fear and horror, and also the ineradicable spirit of resistance, that gripped human society through the plague years.",Max Brooks,https://images.gr-assets.com/books/1528312647l/8908.jpg,4.01
b46,Cujo ,Horror ,"Outside a peaceful town in central Maine, a monster is waiting. Cujo is a two-hundred-pound Saint Bernard, the best friend Brett Camber has ever had. One day Cujo chases a rabbit into a bolt-hole—a cave inhabited by sick bats. What happens to Cujo, how he becomes a horrifying vortex inexorably drawing in all the people around him makes for one of the most heart-stopping novels Stephen King has written",Stephen King,https://images.gr-assets.com/books/1394208144l/10603.jpg,3.69
b47,Doctor Sleep ,Horror ,"Stephen King returns to the characters and territory of one of his most popular novels ever, The Shining, in this instantly riveting novel about the now middle-aged Dan Torrance (the boy protagonist of The Shining) and the very special 12-year-old girl he must save from a tribe of murderous paranormals.On highways across America, a tribe of people called The True Knot travel in search of sustenance. They look harmless - mostly old, lots of polyester, and married to their RVs. But as Dan Torrance knows, and spunky 12-year-old Abra Stone learns, The True Knot are quasi-immortal, living off the ""steam"" that children with the ""shining"" produce when they are slowly tortured to death.Haunted by the inhabitants of the Overlook Hotel where he spent one horrific childhood year, Dan has been drifting for decades, desperate to shed his father's legacy of despair, alcoholism, and violence. Finally, he settles in a New Hampshire town, an AA community that sustains him, and a job at a nursing home where his remnant ""shining"" power provides the crucial final comfort to the dying. Aided by a prescient cat, he becomes ""Doctor Sleep.""",Stephen King,https://images.gr-assets.com/books/1510335480l/16130549.jpg,4.1
b48,House of Leaves ,Horror ,"ears ago, when House of Leaves was first being passed around, it was nothing more than a badly bundled heap of paper, parts of which would occasionally surface on the Internet. No one could have anticipated the small but devoted following this terrifying story would soon command. Starting with an odd assortment of marginalized youth—musicians, tattoo artists, programmers, strippers, environmentalists, and adrenaline junkies—the book eventually made its way into the hands of older generations, who not only found themselves in those strangely arranged pages but also discovered a way back into the lives of their estranged children.Now, for the first time, this astonishing novel is made available in book form, complete with the original colored words, vertical footnotes, and newly added second and third appendices.The story remains unchanged, focusing on a young family that moves into a small home on Ash Tree Lane where they discover something is terribly wrong: their house is bigger on the inside than it is on the outside.",Mark Z. Danielewski,https://images.gr-assets.com/books/1403889034l/24800.jpg,4.12
b49,Needful Things (Paperback) ,Horror ,"Leland Gaunt opens a new shop in Castle Rock called Needful Things. Anyone who enters his store finds the object of his or her lifelong dreams and desires: a prized baseball card, a healing amulet. In addition to a token payment, Gaunt requests that each person perform a little ""deed,"" usually a seemingly innocent prank played on someone else from town. These practical jokes cascade out of control and soon the entire town is doing battle with itself. Only Sheriff Alan Pangborn suspects that Gaunt is behind the population's increasingly violent behavior.",Stephen King,https://images.gr-assets.com/books/1315767817l/107291.jpg,3.9
b50,Christine (Paperback) ,Horror ,"It’s love at first sight for high school student Arnie Cunningham when he and his best friend Dennis Guilder spot the dilapidated 1958 red-and-white Plymouth Fury for sale—dubbed “Christine” by its original cantankerous owner—rusting away on a front lawn of their suburban Pennsylvania neighborhood. Dennis knows that Arnie’s never had much luck in the looks or popularity department, or really taken an interest in owning a car . . . but Christine quickly changes all that. Arnie suddenly has the newfound confidence to stick up for himself, going as far as dating the most beautiful girl at Libertyville High—transfer student Leigh Cabot—even as a mysteriously restored Christine systematically and terrifyingly consumes every aspect of Arnie’s life. Dennis and Leigh soon realize that they must uncover the awful truth behind a car with a horrifying and murderous history. Hell hath no fury like a woman scorned, and heaven help anyone who gets in Christine’s way…","Stephen King , Marie Milpois ",https://images.gr-assets.com/books/1513766289l/10629.jpg,3.75
b51,Bird Box ,Horror ,"Something is out there, something terrifying that must not be seen. One glimpse of it, and a person is driven to deadly violence. No one knows what it is or where it came from.Five years after it began, a handful of scattered survivors remains, including Malorie and her two young children. Living in an abandoned house near the river, she has dreamed of fleeing to a place where they might be safe. Now that the boy and girl are four, it's time to go, but the journey ahead will be terrifying: twenty miles downriver in a rowboat—blindfolded—with nothing to rely on but her wits and the children's trained ears. One wrong choice and they will die. Something is following them all the while, but is it man, animal, or monster?Interweaving past and present, Bird Box is a snapshot of a world unraveled that will have you racing to the final page.",Josh Malerman,https://images.gr-assets.com/books/1383949470l/18498558.jpg,4.03
b52,The Exorcist ,Horror ,"Originally published in 1971, The Exorcist is now a major television series on FOX. It remains one of the most controversial novels ever written and went on to become a literary phenomenon: It spent fifty-seven weeks on the New York Times bestseller list, seventeen consecutively at number one. Inspired by a true story of a child’s demonic possession in the 1940s, William Peter Blatty created an iconic novel that focuses on Regan, the eleven-year-old daughter of a movie actress residing in Washington, D.C. A small group of overwhelmed yet determined individuals must rescue Regan from her unspeakable fate, and the drama that ensues is gripping and unfailingly terrifying.Two years after its publication, The Exorcist was, of course, turned into a wildly popular motion picture, garnering ten Academy Award nominations. On opening day of the film, lines of the novel’s fans stretched around city blocks. In Chicago, frustrated moviegoers used a battering ram to gain entry through the double side doors of a theater. In Kansas City, police used tear gas to disperse an impatient crowd who tried to force their way into a cinema. The three major television networks carried footage of these events; CBS’s Walter Cronkite devoted almost ten minutes to the story. The Exorcist was, and is, more than just a novel and a film: it is a true landmark.Purposefully raw and profane, The Exorcist still has the extraordinary ability to disturb readers and cause them to forget that it is “just a story.” Published here in this beautiful fortieth anniversary edition, it remains an unforgettable reading experience and will continue to shock and frighten a new generation of readers.",Josh Malerman,https://images.gr-assets.com/books/1383949470l/18498558.jpg,4.16
b53,The Kite Runner,Drama,"Amir is the son of a wealthy Kabul merchant, a member of the ruling caste of Pashtuns. Hassan, his servant and constant companion, is a Hazara, a despised and impoverished caste. Their uncommon bond is torn by Amir's choice to abandon his friend amidst the increasing ethnic, religious, and political tensions of the dying years of the Afghan monarchy, wrenching them far apart. But so strong is the bond between the two boys that Amir journeys back to a distant world, to try to right past wrongs against the only true friend he ever had.The unforgettable, heartbreaking story of the unlikely friendship between a wealthy boy and the son of his father’s servant, The Kite Runner is a beautifully crafted novel set in a country that is in the process of being destroyed. It is about the power of reading, the price of betrayal, and the possibility of redemption; and an exploration of the power of fathers over sons—their love, their sacrifices, their lies.",Khaled Hosseini,https://images.gr-assets.com/books/1546093833l/77203.jpg,4.28
b54,My Sister's Keeper,Drama,"Anna is not sick, but she might as well be. By age thirteen, she has undergone countless surgeries, transfusions, and shots so that her older sister, Kate, can somehow fight the leukemia that has plagued her since childhood. The product of preimplantation genetic diagnosis, Anna was conceived as a bone marrow match for Kate -- a life and a role that she has never challenged... until now. Like most teenagers, Anna is beginning to question who she truly is. But unlike most teenagers, she has always been defined in terms of her sister—and so Anna makes a decision that for most would be unthinkable, a decision that will tear her family apart and have perhaps fatal consequences for the sister she loves.A provocative novel that raises some important ethical issues, My Sister's Keeper is the story of one family's struggle for survival at all human costs and a stunning parable for all time", Jodi Picoult,https://images.gr-assets.com/books/1369504683l/10917.jpg,4.07
