book_id,book_title,book_genre,book_plot,book_author,book_link,book_rating
b79,The Hunger Games,Sci-Fi,"Could you survive on your own, in the wild, with everyone out to make sure you don't live to see the morning?In the ruins of a place once known as North America lies the nation of Panem, a shining Capitol surrounded by twelve outlying districts. The Capitol is harsh and cruel and keeps the districts in line by forcing them all to send one boy and one girl between the ages of twelve and eighteen to participate in the annual Hunger Games, a fight to the death on live TV. Sixteen-year-old Katniss Everdeen, who lives alone with her mother and younger sister, regards it as a death sentence when she is forced to represent her district in the Games. But Katniss has been close to dead before - and survival, for her, is second nature. Without really meaning to, she becomes a contender. But if she is to win, she will have to start making choices that weigh survival against humanity and life against love.New York Times bestselling author Suzanne Collins delivers equal parts suspense and philosophy, adventure and romance, in this searing novel set in a future with unsettling parallels to our present.",Suzanne Collins,https://images.gr-assets.com/books/1447303603l/2767052.jpg,4.33
b80,Ready Player One,Sci-Fi,"In the year 2045, reality is an ugly place. The only time teenage Wade Watts really feels alive is when he's jacked into the virtual utopia known as the OASIS. Wade's devoted his life to studying the puzzles hidden within this world's digital confines, puzzles that are based on their creator's obsession with the pop culture of decades past and that promise massive power and fortune to whoever can unlock them. When Wade stumbles upon the first clue, he finds himself beset by players willing to kill to take this ultimate prize. The race is on, and if Wade's going to survive, he'll have to win—and confront the real world he's always been so desperate to escape. ",Ray Bradbury,https://images.gr-assets.com/books/1383718290l.jpg,4.28
b81,Fahrenheit 451,Sci-Fi,"Guy Montag is a fireman. In his world, where television rules and literature is on the brink of extinction, firemen start fires rather than put them out. His job is to destroy the most illegal of commodities, the printed book, along with the houses in which they are hidden.Montag never questions the destruction and ruin his actions produce, returning each day to his bland life and wife, Mildred, who spends all day with her television 'family'. But then he meets an eccentric young neighbor, Clarisse, who introduces him to a past where people did not live in fear and to a present where one sees the world through the ideas in books instead of the mindless chatter of television.When Mildred attempts suicide and Clarisse suddenly disappears, Montag begins to question everything he has ever known",George Orwell,https://images.gr-assets.com/books/1532714506l/40961427.jpg,3.98
b82,1984,Sci-Fi,"Among the seminal texts of the 20th century, Nineteen Eighty-Four is a rare work that grows more haunting as its futuristic purgatory becomes more real. Published in 1949, the book offers political satirist George Orwell's nightmarish vision of a totalitarian, bureaucratic world and one poor stiff's attempt to find individuality. The brilliance of the novel is Orwell's prescience of modern life--the ubiquity of television, the distortion of the language--and his ability to construct such a thorough version of hell. Required reading for students since it was published, it ranks among the most terrifying novels ever written","Aldous Huxley,  Felisberto Albuquerque ",https://images.gr-assets.com/books/1523061131l/5129.jpg,4.17
b83,Brave New World,Sci-Fi,"Brave New World is a dystopian novel written in 1931 by English author Aldous Huxley, and published in 1932. Largely set in a futuristic World State of genetically modified citizens and an intelligence-based social hierarchy, the novel anticipates huge scientific developments in reproductive technology, sleep-learning, psychological manipulation, and classical conditioning that are combined to make a utopian society that goes challenged only by a single outsider.", Isaac Asimov,https://images.gr-assets.com/books/1417900846l/29579.jpg,3.98
b84,Foundation,Sci-Fi,"For twelve thousand years the Galactic Empire has ruled supreme. Now it is dying. But only Hari Seldon, creator of the revolutionary science of psychohistory, can see into the future -- to a dark age of ignorance, barbarism, and warfare that will last thirty thousand years. To preserve knowledge and save mankind, Seldon gathers the best minds in the Empire -- both scientists and scholars -- and brings them to a bleak planet at the edge of the Galaxy to serve as a beacon of hope for a future generations. He calls his sanctuary the Foundation.But soon the fledgling Foundation finds itself at the mercy of corrupt warlords rising in the wake of the receding Empire. Mankind's last best hope is faced with an agonizing choice: submit to the barbarians and be overrun -- or fight them and be destroyed.",Suzanne Collins,https://images.gr-assets.com/books/1358273780l/6148028.jpg,4.15
b85,Catching Fire,Sci-Fi,"Against all odds, Katniss has won the Hunger Games. She and fellow District 12 tribute Peeta Mellark are miraculously still alive. Katniss should be relieved, happy even. After all, she has returned to her family and her longtime friend, Gale. Yet nothing is the way Katniss wishes it to be. Gale holds her at an icy distance. Peeta has turned his back on her completely. And there are whispers of a rebellion against the Capitol - a rebellion that Katniss and Peeta may have helped create.Much to her shock, Katniss has fueled an unrest she's afraid she cannot stop. And what scares her even more is that she's not entirely convinced she should try. As time draws near for Katniss and Peeta to visit the districts on the Capitol's cruel Victory Tour, the stakes are higher than ever. If they can't prove, without a shadow of a doubt, that they are lost in their love for each other, the consequences will be horrifying. In Catching Fire, the second novel in the Hunger Games trilogy, Suzanne Collins continues the story of Katniss Everdeen, testing her more than ever before...and surprising readers at every turn.",Philip K. Dick,https://images.gr-assets.com/books/1507838927l/36402034.jpg,4.29
b86,Do Androids Dream of Electric Sheep?,Sci-Fi,"It was January 2021, and Rick Deckard had a license to kill.Somewhere among the hordes of humans out there, lurked several rogue androids. Deckard's assignment--find them and then...""retire"" them. Trouble was, the androids all looked exactly like humans, and they didn't want to be found!",Suzanne Collins,https://images.gr-assets.com/books/1358275419l/7260188.jpg,4.08
b87,Mockingjay,Sci-Fi,"Katniss Everdeen, girl on fire, has survived, even though her home has been destroyed. Gale has escaped. Katniss's family is safe. Peeta has been captured by the Capitol. District 13 really does exist. There are rebels. There are new leaders. A revolution is unfolding.It is by design that Katniss was rescued from the arena in the cruel and haunting Quarter Quell, and it is by design that she has long been part of the revolution without knowing it. District 13 has come out of the shadows and is plotting to overthrow the Capitol. Everyone, it seems, has had a hand in the carefully laid plans--except Katniss. The success of the rebellion hinges on Katniss's willingness to be a pawn, to accept responsibility for countless lives, and to change the course of the future of Panem. To do this, she must put aside her feelings of anger and distrust. She must become the rebels' Mockingjay--no matter what the personal cost.",H.G. Wells,https://images.gr-assets.com/books/1327942880l/2493.jpg,4.03
b88,The Time Machine,Sci-Fi,"So begins the Time Traveller’s astonishing firsthand account of his journey 800,000 years beyond his own era—and the story that launched H.G. Wells’s successful career and earned him his reputation as the father of science fiction. With a speculative leap that still fires the imagination, Wells sends his brave explorer to face a future burdened with our greatest hopes...and our darkest fears. A pull of the Time Machine’s lever propels him to the age of a slowly dying Earth.  There he discovers two bizarre races—the ethereal Eloi and the subterranean Morlocks—who not only symbolize the duality of human nature, but offer a terrifying portrait of the men of tomorrow as well.  Published in 1895, this masterpiece of invention captivated readers on the threshold of a new century. Thanks to Wells’s expert storytelling and provocative insight, The Time Machine will continue to enthrall readers for generations to come","William Gibson,  Jack Womack ",https://images.gr-assets.com/books/1281419771l/888628.jpg,3.88
b89,Neuromancer,Sci-Fi,"Case was the sharpest data thief in the Matrix, until an ex-employer crippled his nervous system. Now a new employer has recruited him for a last-chance run against an unthinkably powerful artificial intelligence. With a mirror-eyed girl street-samurai riding shotgun, he's ready for the silicon-quick, bleakly prophetic adventure that upped the ante on an entire genre of fiction", Isaac Asimov,https://images.gr-assets.com/books/1388321463l/41804.jpg,3.89
b90,"I, Robot",Sci-Fi,"The three laws of Robotics: 1) A robot may not injure a human being or, through inaction, allow a human being to come to harm.2) A robot must obey orders given to it by human beings except where such orders would conflict with the First Law.3) A robot must protect its own existence as long as such protection does not conflict with the First or Second Law.With these three, simple directives, Isaac Asimov changed our perception of robots forever when he formulated the laws governing their behavior. In I, Robot, Asimov chronicles the development of the robot through a series of interlinked stories: from its primitive origins in the present to its ultimate perfection in the not-so-distant future--a future in which humanity itself may be rendered obsolete.Here are stories of robots gone mad, of mind-read robots, and robots with a sense of humor. Of robot politicians, and robots who secretly run the world--all told with the dramatic blend of science fact and science fiction that has become Asimov's trademark.",Isaac Asimov,https://images.gr-assets.com/books/1388321463l/41804.jpg,4.19
b91,"Good Omens: The Nice and Accurate Prophecies of Agnes Nutter, Witch",Comedy,"\An alternative cover for this ISBN can be found hereAccording to The Nice and Accurate Prophecies of Agnes Nutter, Witch (the world's only completely accurate book of prophecies, written in 1655, before she exploded), the world will end on a Saturday. Next Saturday, in fact. Just before dinner.So the armies of Good and Evil are amassing, Atlantis is rising, frogs are falling, tempers are flaring. Everything appears to be going according to Divine Plan. Except a somewhat fussy angel and a fast-living demon—both of whom have lived amongst Earth's mortals since The Beginning and have grown rather fond of the lifestyle—are not actually looking forward to the coming Rapture.And someone seems to have misplaced the Antichrist . . . ","Terry Pratchett,  Neil Gaiman",https://images.gr-assets.com/books/1392528568l/12067.jpg,4.25
b92,Is Everyone Hanging Out Without Me?,Comedy,"Mindy Kaling has lived many lives: the obedient child of immigrant professionals, a timid chubster afraid of her own bike, a Ben Affleck–impersonating Off-Broadway performer and playwright, and, finally, a comedy writer and actress prone to starting fights with her friends and coworkers with the sentence “Can I just say one last thing about this, and then I swear I’ll shut up about it?” Perhaps you want to know what Mindy thinks makes a great best friend (someone who will fill your prescription in the middle of the night), or what makes a great guy (one who is aware of all elderly people in any room at any time and acts accordingly), or what is the perfect amount of fame (so famous you can never get convicted of murder in a court of law), or how to maintain a trim figure (you will not find that information in these pages). If so, you’ve come to the right book, mostly!In Is Everyone Hanging Out Without Me?, Mindy invites readers on a tour of her life and her unscientific observations on romance, friendship, and Hollywood, with several conveniently placed stopping points for you to run errands and make phone calls. Mindy Kaling really is just a Girl Next Door—not so much literally anywhere in the continental United States, but definitely if you live in India or Sri Lanka.", Mindy Kaling,https://images.gr-assets.com/books/1443264638l/10335308.jpg,3.85
b93,Yes Please,Comedy,"In Amy Poehler’s highly anticipated first book, Yes Please, she offers up a big juicy stew of personal stories, funny bits on sex and love and friendship and parenthood and real life advice (some useful, some not so much), like when to be funny and when to be serious. Powered by Amy’s charming and hilarious, biting yet wise voice, Yes Please is a book full of words to live by",Amy Poehler,https://images.gr-assets.com/books/1402815435l/20910157.jpg,3.82
b94,The Restaurant at the End of the Universe,Comedy,"Facing annihilation at the hands of the warlike Vogons is a curious time to have a cosmically displaced Arthur Dent and his curious comrades in arms as they hurtle through space powered by pure improbability - and desperately in search of a place to eat. Among Arthur's motley shipmates are Ford Prefect, a long-time friend and contributor to the The Hitch Hiker's Guide to the Galaxy; Zaphod Beeblebrox, the three-armed, two-headed ex-president of the galaxy; Tricia McMilan, a fellow Earth refuge who's gone native (her name is Trillian now); and Marvin, who suffers nothing and no one gladly.",Douglas Adams,https://images.gr-assets.com/books/1521213881l/8695.jpg,4.22
b95,Me Talk Pretty One Day,Comedy,"David Sedaris' move to Paris from New York inspired these hilarious pieces, including the title essay, about his attempts to learn French from a sadistic teacher who declares that every day spent with you is like having a caesarean section. His family is another inspiration. You Can't Kill the Rooster is a portrait of his brother, who talks incessant hip-hop slang to his bewildered father. And no one hones a finer fury in response to such modern annoyances as restaurant meals presented in ludicrous towers of food and cashiers with six-inch fingernails.",David Sedaris,https://images.gr-assets.com/books/1431013639l/4137.jpg,3.98
b96,The Color of Magic,Comedy,"Terry Pratchett's profoundly irreverent, bestselling novels have garnered him a revered position in the halls of parody next to the likes of Mark Twain, Kurt Vonnegut, Douglas Adams, and Carl Hiaasen. The Color of Magic is Terry Pratchett's maiden voyage through the now-legendary land of Discworld. This is where it all begins -- with the tourist Twoflower and his wizard guide, Rincewind. On a world supported on the back of a giant turtle (sex unknown), a gleeful, explosive, wickedly eccentric expedition sets out. There's an avaricious but inept wizard, a naive tourist whose luggage moves on hundreds of dear little legs, dragons who only exist if you believe in them, and of course THE EDGE of the planet... ",Terry Pratchett,https://images.gr-assets.com/books/1407111017l/34497.jpg,3.99
b97,"Life, the Universe and Everything",Comedy,"The unhappy inhabitants of planet Krikkit are sick of looking at the night sky above their heads–so they plan to destroy it. The universe, that is. Now only five individuals stand between the killer robots of Krikkit and their goal of total annihilation.They are Arthur Dent, a mild-mannered space and time traveler who tries to learn how to fly by throwing himself at the ground and missing; Ford Prefect, his best friend, who decides to go insane to see if he likes it; Slartibartfast, the indomitable vice president of the Campaign for Real Time, who travels in a ship powered by irrational behavior; Zaphod Beeblebrox, the two-headed, three-armed ex-president of the galazy; and Trillian, the sexy space cadet who is torn between a persistent Thunder God and a very depressed Beeblebrox.How will it all end? Will it end? Only this stalwart crew knows as they try to avert “universal” Armageddon and save life as we know it–and don’t know it!",Douglas Adams,https://images.gr-assets.com/books/1333577589l/8694.jpg,4.2
b98,Assuming Names: A Con Artist's Masquerade,Comedy,"The detectives were embarrassed but they still wanted answered, ""How did a 15-year-old runaway successfully pose as a world traveled countess?"" The newspapers turned it back on them, practically sneering, ""How did she do it while under investigation by the FBI, DEA, and Interpol?"" The Mafia had been demanding the same thing for six months, ""What is your real name?"" And the psychologists asked the question they always ask, ""Why?"" It’s the why of it that will keep a girl in trouble. Assuming Names is the true story of a young con artist. It’s the tale of a runaway that assumed the title of Countess and then went on to fool the FBI, DEA, and Interpol—as well as a number of other celebrities and institutions—with an elaborate tale of world intrigue.A NOTE FROM THE AUTHOR: Hello everyone. This is Tanya. You may find yourself reading my book and saying, “No, this did not happen.” You may be inclined to say it is too far-fetched and, quite frankly, impossible. I have provided evidence at my website that what I write is the truth. I mention it at the front of the book but it may be easy to overlook, so I am reiterating here.At my website are copies of the newspaper and magazine articles mentioned in the book. The articles are from the Austin American Statesman, The Dallas Morning News, and Woman’s World Magazine. They are all nationally recognized media for news. Previous reviewers were concerned I may have gone to Photoshop to create them, and while my book does paint me as the sort that would do such a thing, the reality is that those media institutions would sue me into submission before the cache could be cleared. ",Tanya Thompson,https://images.gr-assets.com/books/1394851829l/21449526.jpg,3.51
b99,"So Long, and Thanks for All the Fish",Comedy,"Back on Earth with nothing more to show for his long, strange trip through time and space than a ratty towel and a plastic shopping bag, Arthur Dent is ready to believe that the past eight years were all just a figment of his stressed-out imagination. But a gift-wrapped fishbowl with a cryptic inscription, the mysterious disappearance of Earth's dolphins, and the discovery of his battered copy of The Hitchhiker's Guide to the Galaxy all conspire to give Arthur the sneaking suspicion that something otherworldly is indeed going on. . . .God only knows what it all means. And fortunately, He left behind a Final Message of explanation. But since it's light-years away from Earth, on a star surrounded by souvenir booths, finding out what it is will mean hitching a ride to the far reaches of space aboard a UFO with a giant robot. But what else is new?",Douglas Adams,https://images.gr-assets.com/books/1327873354l/6091075.jpg,4.09
b100,"Lamb: The Gospel According to Biff, Christ's Childhood Pal",Comedy,"The birth of Jesus has been well chronicled, as have his glorious teachings, acts, and divine sacrifice after his thirtieth birthday. But no one knows about the early life of the Son of God, the missing years—except Biff, the Messiah's best bud, who has been resurrected to tell the story in the divinely hilarious yet heartfelt work ""reminiscent of Vonnegut and Douglas Adams"" (Philadelphia Inquirer).Verily, the story Biff has to tell is a miraculous one, filled with remarkable journeys, magic, healings, kung fu, corpse reanimations, demons, and hot babes. Even the considerable wiles and devotion of the Savior's pal may not be enough to divert Joshua from his tragic destiny. But there's no one who loves Josh more—except maybe ""Maggie,"" Mary of Magdala—and Biff isn't about to let his extraordinary pal suffer and ascend without a fight. ",Christopher Moore,https://images.gr-assets.com/books/1331419009l/28881.jpg,4.26
b101,The Princess Bride,Comedy,"What happens when the most beautiful girl in the world marries the handsomest prince of all time and he turns out to be...well...a lot less than the man of her dreams?As a boy, William Goldman claims, he loved to hear his father read the S. Morgenstern classic, The Princess Bride. But as a grown-up he discovered that the boring parts were left out of good old Dad's recitation, and only the ""good parts"" reached his ears.Now Goldman does Dad one better. He's reconstructed the ""Good Parts Version"" to delight wise kids and wide-eyed grownups everywhere.What's it about? Fencing. Fighting. True Love. Strong Hate. Harsh Revenge. A Few Giants. Lots of Bad Men. Lots of Good Men. Five or Six Beautiful Women. Beasties Monstrous and Gentle. Some Swell Escapes and Captures. Death, Lies, Truth, Miracles, and a Little Sex.In short, it's about everything", William Goldman,https://images.gr-assets.com/books/1327903636l/21787.jpg,4.26
b102,The Importance of Being Earnest,Comedy,"Oscar Wilde's madcap farce about mistaken identities, secret engagements, and lovers entanglements still delights readers more than a century after its 1895 publication and premiere performance. The rapid-fire wit and eccentric characters of The Importance of Being Earnest have made it a mainstay of the high school curriculum for decades.Cecily Cardew and Gwendolen Fairfax are both in love with the same mythical suitor. Jack Worthing has wooed Gwendolen as Ernest while Algernon has also posed as Ernest to win the heart of Jack's ward, Cecily. When all four arrive at Jack's country home on the same weekend the ""rivals"" to fight for Ernest's undivided attention and the ""Ernests"" to claim their beloveds pandemonium breaks loose. Only a senile nursemaid and an old, discarded hand-bag can save the day!This Prestwick House Literary Touchstone Edition includes a glossary and reader's notes to help the modern reader appreciate Wilde's wry wit and elaborate plot twists. ",Oscar Wilde,https://images.gr-assets.com/books/1298438452l/92303.jpg,4.17
